{
  "source": "mitre-attack/attack-stix-data",
  "domain": "enterprise-attack",
  "generated": "2026-08-25T08:23:36.130Z",
  "techniques": {
    "T1001": {
      "name": "Data Obfuscation",
      "tactics": [
        "command-and-control"
      ]
    },
    "T1001.001": {
      "name": "Junk Data",
      "tactics": [
        "command-and-control"
      ],
      "parent": "T1001"
    },
    "T1001.002": {
      "name": "Steganography",
      "tactics": [
        "command-and-control"
      ],
      "parent": "T1001"
    },
    "T1001.003": {
      "name": "Protocol or Service Impersonation",
      "tactics": [
        "command-and-control"
      ],
      "parent": "T1001"
    },
    "T1003": {
      "name": "OS Credential Dumping",
      "tactics": [
        "credential-access"
      ]
    },
    "T1003.001": {
      "name": "LSASS Memory",
      "tactics": [
        "credential-access"
      ],
      "parent": "T1003"
    },
    "T1003.002": {
      "name": "Security Account Manager",
      "tactics": [
        "credential-access"
      ],
      "parent": "T1003"
    },
    "T1003.003": {
      "name": "NTDS",
      "tactics": [
        "credential-access"
      ],
      "parent": "T1003"
    },
    "T1003.004": {
      "name": "LSA Secrets",
      "tactics": [
        "credential-access"
      ],
      "parent": "T1003"
    },
    "T1003.005": {
      "name": "Cached Domain Credentials",
      "tactics": [
        "credential-access"
      ],
      "parent": "T1003"
    },
    "T1003.006": {
      "name": "DCSync",
      "tactics": [
        "credential-access"
      ],
      "parent": "T1003"
    },
    "T1003.007": {
      "name": "Proc Filesystem",
      "tactics": [
        "credential-access"
      ],
      "parent": "T1003"
    },
    "T1003.008": {
      "name": "/etc/passwd and /etc/shadow",
      "tactics": [
        "credential-access"
      ],
      "parent": "T1003"
    },
    "T1005": {
      "name": "Data from Local System",
      "tactics": [
        "collection"
      ]
    },
    "T1006": {
      "name": "Direct Volume Access",
      "tactics": [
        "stealth"
      ]
    },
    "T1007": {
      "name": "System Service Discovery",
      "tactics": [
        "discovery"
      ]
    },
    "T1008": {
      "name": "Fallback Channels",
      "tactics": [
        "command-and-control"
      ]
    },
    "T1010": {
      "name": "Application Window Discovery",
      "tactics": [
        "discovery"
      ]
    },
    "T1011": {
      "name": "Exfiltration Over Other Network Medium",
      "tactics": [
        "exfiltration"
      ]
    },
    "T1011.001": {
      "name": "Exfiltration Over Bluetooth",
      "tactics": [
        "exfiltration"
      ],
      "parent": "T1011"
    },
    "T1012": {
      "name": "Query Registry",
      "tactics": [
        "discovery"
      ]
    },
    "T1014": {
      "name": "Rootkit",
      "tactics": [
        "stealth"
      ]
    },
    "T1016": {
      "name": "System Network Configuration Discovery",
      "tactics": [
        "discovery"
      ]
    },
    "T1016.001": {
      "name": "Internet Connection Discovery",
      "tactics": [
        "discovery"
      ],
      "parent": "T1016"
    },
    "T1016.002": {
      "name": "Wi-Fi Discovery",
      "tactics": [
        "discovery"
      ],
      "parent": "T1016"
    },
    "T1018": {
      "name": "Remote System Discovery",
      "tactics": [
        "discovery"
      ]
    },
    "T1020": {
      "name": "Automated Exfiltration",
      "tactics": [
        "exfiltration"
      ]
    },
    "T1020.001": {
      "name": "Traffic Duplication",
      "tactics": [
        "exfiltration"
      ],
      "parent": "T1020"
    },
    "T1021": {
      "name": "Remote Services",
      "tactics": [
        "lateral-movement"
      ]
    },
    "T1021.001": {
      "name": "Remote Desktop Protocol",
      "tactics": [
        "lateral-movement"
      ],
      "parent": "T1021"
    },
    "T1021.002": {
      "name": "SMB/Windows Admin Shares",
      "tactics": [
        "lateral-movement"
      ],
      "parent": "T1021"
    },
    "T1021.003": {
      "name": "Distributed Component Object Model",
      "tactics": [
        "lateral-movement"
      ],
      "parent": "T1021"
    },
    "T1021.004": {
      "name": "SSH",
      "tactics": [
        "lateral-movement"
      ],
      "parent": "T1021"
    },
    "T1021.005": {
      "name": "VNC",
      "tactics": [
        "lateral-movement"
      ],
      "parent": "T1021"
    },
    "T1021.006": {
      "name": "Windows Remote Management",
      "tactics": [
        "lateral-movement"
      ],
      "parent": "T1021"
    },
    "T1021.007": {
      "name": "Cloud Services",
      "tactics": [
        "lateral-movement"
      ],
      "parent": "T1021"
    },
    "T1021.008": {
      "name": "Direct Cloud VM Connections",
      "tactics": [
        "lateral-movement"
      ],
      "parent": "T1021"
    },
    "T1025": {
      "name": "Data from Removable Media",
      "tactics": [
        "collection"
      ]
    },
    "T1027": {
      "name": "Obfuscated Files or Information",
      "tactics": [
        "stealth"
      ]
    },
    "T1027.001": {
      "name": "Binary Padding",
      "tactics": [
        "stealth"
      ],
      "parent": "T1027"
    },
    "T1027.002": {
      "name": "Software Packing",
      "tactics": [
        "stealth"
      ],
      "parent": "T1027"
    },
    "T1027.003": {
      "name": "Steganography",
      "tactics": [
        "stealth"
      ],
      "parent": "T1027"
    },
    "T1027.004": {
      "name": "Compile After Delivery",
      "tactics": [
        "stealth"
      ],
      "parent": "T1027"
    },
    "T1027.005": {
      "name": "Indicator Removal from Tools",
      "tactics": [
        "stealth"
      ],
      "parent": "T1027"
    },
    "T1027.006": {
      "name": "HTML Smuggling",
      "tactics": [
        "stealth"
      ],
      "parent": "T1027"
    },
    "T1027.007": {
      "name": "Dynamic API Resolution",
      "tactics": [
        "stealth"
      ],
      "parent": "T1027"
    },
    "T1027.008": {
      "name": "Stripped Payloads",
      "tactics": [
        "stealth"
      ],
      "parent": "T1027"
    },
    "T1027.009": {
      "name": "Embedded Payloads",
      "tactics": [
        "stealth"
      ],
      "parent": "T1027"
    },
    "T1027.010": {
      "name": "Command Obfuscation",
      "tactics": [
        "stealth"
      ],
      "parent": "T1027"
    },
    "T1027.011": {
      "name": "Fileless Storage",
      "tactics": [
        "stealth"
      ],
      "parent": "T1027"
    },
    "T1027.012": {
      "name": "LNK Icon Smuggling",
      "tactics": [
        "stealth"
      ],
      "parent": "T1027"
    },
    "T1027.013": {
      "name": "Encrypted/Encoded File",
      "tactics": [
        "stealth"
      ],
      "parent": "T1027"
    },
    "T1027.014": {
      "name": "Polymorphic Code",
      "tactics": [
        "stealth"
      ],
      "parent": "T1027"
    },
    "T1027.015": {
      "name": "Compression",
      "tactics": [
        "stealth"
      ],
      "parent": "T1027"
    },
    "T1027.016": {
      "name": "Junk Code Insertion",
      "tactics": [
        "stealth"
      ],
      "parent": "T1027"
    },
    "T1027.017": {
      "name": "SVG Smuggling",
      "tactics": [
        "stealth"
      ],
      "parent": "T1027"
    },
    "T1027.018": {
      "name": "Invisible Unicode",
      "tactics": [
        "stealth"
      ],
      "parent": "T1027"
    },
    "T1029": {
      "name": "Scheduled Transfer",
      "tactics": [
        "exfiltration"
      ]
    },
    "T1030": {
      "name": "Data Transfer Size Limits",
      "tactics": [
        "exfiltration"
      ]
    },
    "T1033": {
      "name": "System Owner/User Discovery",
      "tactics": [
        "discovery"
      ]
    },
    "T1036": {
      "name": "Masquerading",
      "tactics": [
        "stealth"
      ]
    },
    "T1036.001": {
      "name": "Invalid Code Signature",
      "tactics": [
        "stealth"
      ],
      "parent": "T1036"
    },
    "T1036.002": {
      "name": "Right-to-Left Override",
      "tactics": [
        "stealth"
      ],
      "parent": "T1036"
    },
    "T1036.003": {
      "name": "Rename Legitimate Utilities",
      "tactics": [
        "stealth"
      ],
      "parent": "T1036"
    },
    "T1036.004": {
      "name": "Masquerade Task or Service",
      "tactics": [
        "stealth"
      ],
      "parent": "T1036"
    },
    "T1036.005": {
      "name": "Match Legitimate Resource Name or Location",
      "tactics": [
        "stealth"
      ],
      "parent": "T1036"
    },
    "T1036.006": {
      "name": "Space after Filename",
      "tactics": [
        "stealth"
      ],
      "parent": "T1036"
    },
    "T1036.007": {
      "name": "Double File Extension",
      "tactics": [
        "stealth"
      ],
      "parent": "T1036"
    },
    "T1036.008": {
      "name": "Masquerade File Type",
      "tactics": [
        "stealth"
      ],
      "parent": "T1036"
    },
    "T1036.009": {
      "name": "Break Process Trees",
      "tactics": [
        "stealth"
      ],
      "parent": "T1036"
    },
    "T1036.010": {
      "name": "Masquerade Account Name",
      "tactics": [
        "stealth"
      ],
      "parent": "T1036"
    },
    "T1036.011": {
      "name": "Overwrite Process Arguments",
      "tactics": [
        "stealth"
      ],
      "parent": "T1036"
    },
    "T1036.012": {
      "name": "Browser Fingerprint",
      "tactics": [
        "stealth"
      ],
      "parent": "T1036"
    },
    "T1037": {
      "name": "Boot or Logon Initialization Scripts",
      "tactics": [
        "persistence",
        "privilege-escalation"
      ]
    },
    "T1037.001": {
      "name": "Logon Script (Windows)",
      "tactics": [
        "persistence",
        "privilege-escalation"
      ],
      "parent": "T1037"
    },
    "T1037.002": {